{
  "schema_version": 1,
  "font": {
    "sans": "\"ProjectSourceHanSans\", \"思源柔体\", \"Source Han Sans SC\", \"Source Han Sans CN\", \"Noto Sans CJK SC\", \"HarmonyOS Sans SC\", \"MiSans\", \"PingFang SC\", \"Microsoft YaHei UI\", \"Microsoft YaHei\", \"Segoe UI\", system-ui, -apple-system, sans-serif"
  },
  "light": {
    "background": "#f5f6f3",
    "surface": "#ffffff",
    "surface_strong": "#fafbf8",
    "border": "#d9dfd5",
    "text": "#202a33",
    "muted": "#60707c",
    "subtle": "#87929a",
    "primary": "#245b75",
    "primary_strong": "#164154",
    "danger": "#a73d46",
    "danger_soft": "#fae8e9",
    "success": "#24745b",
    "success_soft": "#e6f3ea",
    "warning": "#a66a17",
    "warning_soft": "#fff1d7",
    "accent": "#6f4a8e",
    "shadow": "0 20px 60px rgb(51 66 75 / 0.1)"
  },
  "dark": {
    "background": "#151a1d",
    "surface": "#20262a",
    "surface_strong": "#252c31",
    "border": "#354047",
    "text": "#edf2f4",
    "muted": "#a4b0b7",
    "subtle": "#7e8b94",
    "primary": "#5fa8c8",
    "primary_strong": "#9bd2e6",
    "danger": "#ff8a92",
    "danger_soft": "#44292d",
    "success": "#76d1a5",
    "success_soft": "#1e3b31",
    "warning": "#f0b761",
    "warning_soft": "#47351e",
    "accent": "#c6a5e4",
    "shadow": "0 20px 60px rgb(0 0 0 / 0.32)"
  },
  "spacing": {
    "content": "16px",
    "theme": "32px"
  },
  "radius": {
    "control": "14px",
    "card": "20px",
    "panel": "26px"
  }
}

